{
  "$schema": "https://json-schema.org/draft/2020-12/schema",
  "$id": "agenticflow/setupref/root.schema.json",
  "title": "Repo Root Spec Config",
  "description": "Repo-wide spec-driven-development config. One per repo, at .spec/repo.json. The foundational schema every repo receives; layer and feature schemas extend the model rooted here.",
  "type": "object",
  "required": ["setupRefVersion", "repo", "owners", "data_classification", "layers", "specConfig"],
  "properties": {
    "setupRefVersion": {
      "type": "string",
      "description": "setupref version this scaffold was generated from.",
      "pattern": "^[0-9]+\\.[0-9]+\\.[0-9]+$"
    },
    "repo": {
      "type": "string",
      "description": "Repo alias / name.",
      "minLength": 1
    },
    "owners": {
      "type": "array",
      "description": "Accountable humans/teams for this repo's specs.",
      "minItems": 1,
      "items": { "type": "string" }
    },
    "data_classification": {
      "type": "string",
      "description": "Highest data sensitivity this repo handles. 'regulated' (e.g. proprietary genetic/chemistry data) must only be routed to approved models — see specConfig.approvedModels and the repo overlay agentOverrides.",
      "enum": ["public", "internal", "confidential", "regulated"]
    },
    "layers": {
      "type": "array",
      "description": "Architectural layers present in this repo. Drives which layer schemas apply.",
      "minItems": 1,
      "items": { "enum": ["frontend", "backend", "database", "contract"] }
    },
    "specConfig": {
      "type": "object",
      "required": ["specsDir", "parityModel", "featuresDir"],
      "properties": {
        "specsDir": { "type": "string", "description": "Where feature specs live, e.g. 'specs'." },
        "featuresDir": { "type": "string", "description": "Where per-feature folders live, e.g. 'specs/features'." },
        "parityModel": {
          "type": "string",
          "description": "Active setupref model. 'single' = spec.tech.md + components.md kept in component-ID parity.",
          "enum": ["single"]
        },
        "approvedModels": {
          "type": "array",
          "description": "Models allowed to process this repo's data given its data_classification.",
          "items": { "type": "string" }
        }
      }
    },
    "repoProfile": {
      "type": "object",
      "description": "Detected repository profile written by setupref init.",
      "properties": {
        "packageManager": { "type": "string" },
        "stack": { "type": "array", "items": { "type": "string" } },
        "detectedAt": { "type": "string" }
      }
    },
    "commands": {
      "type": "object",
      "description": "Repo-relative commands discovered at bootstrap.",
      "properties": {
        "install": { "type": "string" },
        "test": { "type": "string" },
        "typecheck": { "type": "string" },
        "lint": { "type": "string" },
        "build": { "type": "string" }
      }
    },
    "evidencePolicy": {
      "type": "object",
      "description": "How evidence should be stored. setupref uses pointer evidence to keep token usage low.",
      "properties": {
        "mode": { "enum": ["pointer"] },
        "root": { "type": "string" },
        "maxInlineSummaryChars": { "type": "integer" }
      }
    },
    "holdoutPolicy": {
      "type": "object",
      "description": "Where hidden/late-loaded validation suites live.",
      "properties": {
        "root": { "type": "string" },
        "implementationAgentsDoNotReadHoldouts": { "type": "boolean" }
      }
    }
  }
}
