{
  "setupRefVersion": "0.1.0",
  "repo": "cairn",
  "owners": [
    "Cairn team"
  ],
  "data_classification": "confidential",
  "layers": [
    "contract",
    "database",
    "backend",
    "frontend"
  ],
  "specConfig": {
    "specsDir": "specs",
    "featuresDir": "specs/features",
    "parityModel": "single",
    "approvedModels": [
      "claude-sonnet-5"
    ]
  },
  "repoProfile": {
    "packageManager": "pip",
    "stack": [
      "python",
      "sqlite",
      "mcp",
      "playwright",
      "pytest"
    ],
    "detectedAt": "2026-07-11T23:03:45.840Z"
  },
  "commands": {
    "install": "python -m pip install -r ingestion/requirements.txt",
    "test": "python -m pytest tests/",
    "validate": "python scripts/setupref_validate.py"
  },
  "evidencePolicy": {
    "mode": "pointer",
    "root": ".spec/evidence",
    "maxInlineSummaryChars": 500
  },
  "holdoutPolicy": {
    "root": ".spec/holdouts",
    "implementationAgentsDoNotReadHoldouts": true
  }
}
